market,sector,symbol,symbol_name,description,link_website,one_report_link
SET,PROP,S,บริษัท สิงห์ เอสเตท จำกัด (มหาชน),พัฒนาและลงทุนในอสังหาริมทรัพย์,http://www.singhaestate.co.th,https://weblink.set.or.th/dat/f56/0940ONE260320242015270513T.zip
SET,PROP,SA,บริษัท ไซมิส แอสเสท จำกัด (มหาชน),พัฒนาอสังหาริมทรัพย์เพื่อที่อยู่อาศัยเพื่อจำหน่าย ทั้งประเภทโครงการคอนโดมิเนียม บ้านจัดสรร ทาวน์โฮม และโฮมออฟฟิศ และให้บริการบริหารงานนิติบุคคลให้กับโครงการต่างๆ ของบริษัท,http://www.siameseasset.co.th,https://weblink.set.or.th/dat/f56/1284ONE130520241510370816T.zip
SET,PROP,SAMCO,บริษัท สัมมากร จำกัด (มหาชน),พัฒนาอสังหาริมทรัพย์โดยเน้นการพัฒนาโครงการที่อยู่อาศัยแนวราบและแนวสูง พร้อมทั้งการให้บริการบำรุงรักษาโครงการภายหลังการขาย,http://www.sammakorn.co.th,https://weblink.set.or.th/dat/f56/0349ONE270320241932080608T.zip
SET,PROP,SC,บริษัท เอสซี แอสเสท คอร์ปอเรชั่น จำกัด (มหาชน),พัฒนาอสังหาริมทรัพย์,http://www.scasset.com,https://weblink.set.or.th/dat/f56/0747ONE250320241651120290T.zip
SET,PROP,SENA,บริษัท เสนาดีเวลลอปเม้นท์ จำกัด (มหาชน),- ประกอบธุรกิจพัฒนาอสังหาริมทรัพย์ประเภทที่อยู่อาศัย ได้แก่ บ้านเดี่ยว ทาวเฮ้าส์ อาคารพาณิชย์ ทาวน์โฮมและอาคารชุด - ประกอบธุรกิจเช่า ได้แก่ อพาร์ทเม้นท์ให้เช่า ศูนย์การค้าขนาดเล็ก (Community Mall) ธุรกิจอาคารสำนักงาน- ประกอบธุรกิจสนามกอล์ฟ- ประกอบธุรกิจไฟฟ้าพลังงานแสงอาทิตย์- ประกอบธุรกิจบริหารงานนิติบุคคล- ประกอบธุรกิจรับเหมาก่อสร้างที่พักอาศัย- ประกอบธุรกิจตัวแทนและนายหน้าให้บริการซื้อขายอสังหาริมทรัพย์,http://www.sena.co.th,https://weblink.set.or.th/dat/f56/1011ONE230420240905110751T.zip
SET,PROP,SIRI,บริษัท แสนสิริ จำกัด (มหาชน),พัฒนาอสังหาริมทรัพย์เป็นหลัก โดยพัฒนาโครงการที่อยู่อาศัยประเภทบ้านเดี่ยว บ้านแฝด ทาวน์โฮม และคอนโดมิเนียม ในพื้นที่กรุงเทพมหานครและปริมณฑล ตลอดจนจังหวัดต่าง ๆ ที่สำคัญ นอกจากนี้ ยังมีธุรกิจบริการอสังหาริมทรัพย์ โดยให้บริการด้านการบริหารและจัดการโครงการอสังหาริมทรัพย์ บริหารงานขายโครงการ และบริการตัวแทนซื้อ-ขายอสังหาริมทรัพย์,http://www.sansiri.com,https://weblink.set.or.th/dat/f56/0577ONE290320241420090716T.zip
SET,PROP,SPALI,บริษัท ศุภาลัย จำกัด (มหาชน),พัฒนาอสังหาริมทรัพย์ประเภท 1) ที่อยู่อาศัย ทั้งบ้านและที่ดินจัดสรร อาคารชุด ในทำเลทั่วเขตกรุงเทพมหานคร ปริมณฑล รวมถึงต่างจังหวัด 2) เพื่อการพาณิชย์ ได้แก่ อาคารสำนักงานให้เช่า  และ 3) ธุรกิจรีสอร์ทโรงแรมในต่างจังหวัด,http://www.supalai.com,https://weblink.set.or.th/dat/f56/0371ONE250320241634040564T.zip
SET,PROP,UV,บริษัท ยูนิเวนเจอร์ จำกัด (มหาชน),ลงทุนในกิจการอื่น โดยกลุ่มบริษัทดำเนินธุรกิจหลัก 3 สายธุรกิจ ได้แก่ (1) ธุรกิจการลงทุน ซึ่งปัจจุบันบริษัทย่อยของบริษัทเข้าลงทุนในธุรกิจพลังงาน ธุรกิจตู้แช่เชิงพาณิชย์ และธุรกิจที่ปรึกษาบริหารและควบคุมงานก่อสร้าง (2) ธุรกิจอสังหาริมทรัพย์และธุรกิจที่เกี่ยวข้อง และ (3) ธุรกิจด้านอุตสาหกรรม ได้แก่ ธุรกิจผลิตและจำหน่ายผงสังกะสีออกไซด์และเคมีภัณฑ์,http://www.univentures.co.th,https://weblink.set.or.th/dat/f56/0136ONE201220231223320008T.zip
SET,PROP,WHA,บริษัท ดับบลิวเอชเอ คอร์ปอเรชั่น จำกัด (มหาชน),บริษัทฯ เป็นผู้นำในการให้บริการแบบครบวงจรที่ครอบคลุมทุกความต้องการของลูกค้าในธุรกิจที่เกี่ยวข้องกับการให้บริการด้านโลจิสติกส์ โดยสามารถจำแนกส่วนธุรกิจได้เป็น 4 กลุ่ม ได้แก่ ธุรกิจโลจิสติกส์ (Logistics) ธุรกิจพัฒนานิคมอุตสาหกรรม (Industrial Development) ธุรกิจให้บริการสาธารณูปโภคและพลังงาน (Utilities & Power) และธุรกิจดิจิทัล (Digital Business) อีกทั้งบริษัทฯ ยังมีนโยบายในการขายสินทรัพย์เข้ากองทรัสต์ฯ (WHART WHAIR และ WHABT) เพื่อเป็นแหล่งเงินทุนในการพัฒนาโครงการในอนาคตของบริษัทฯ อย่างต่อเนื่อง และได้รับแต่งตั้งเป็นผู้บริหารอสังหาริมทรัพย์ของกองทรัสต์ฯ และกองทุนรวมฯ นอกจากนี้ บริษัทฯ ยังมีนโยบายลงทุนในธุรกิจอสังหาริมทรัพย์ผ่านการลงทุนในกองทรัสต์ฯ และ/หรือกองทุนรวมฯ เพื่อผลตอบแทนในรูปเงินปันผลสม่ำเสมอเป็นประจำทุกปี,https://www.wha-group.com,https://weblink.set.or.th/dat/f56/1107ONE260320241010410213T.zip
SET,PROP,WIN,บริษัท สวนอุตสาหกรรม วินโคสท์ จำกัด (มหาชน),ให้เช่าอสังหาริมทรัพย์ ประเภทพื้นที่ อาคารโรงงาน บริเวณติดถนนบางนา-ตราด ก.ม 52  โดยแบ่งเป็น 3 ส่วน คือ 1) พื้นที่ให้เช่าและบริการในเขตปลอดอากร (Free Zone)2) พื้นที่ให้เช่าและบริการนอกเขตปลอดอากร3) พื้นที่ให้เช่าและบริการบนหลังคา,http://www.wyncoast.com,https://weblink.set.or.th/dat/f56/0188ONE260320241928370253T.zip
SET,PF&REIT,AIMCG,ทรัสต์เพื่อการลงทุนในอสังหาริมทรัพย์และสิทธิการเช่าอสังหาริมทรัพย์ เอไอเอ็ม คอมเมอร์เชียล โกรท,ลงทุนในสิทธิการเช่าและสิทธิการเช่าช่วงศูนย์การค้าคอมมูนิตี้มอลล์ 3 โครงการ ได้แก่ โครงการยูดี ทาวน์ โครงการ 72 คอร์ทยาร์ด และโครงการพอร์โต้ ชิโน่ และลงทุนในกรรมสิทธิ์ในห้องชุดซึ่งมีวัตถุประสงค์เพื่อการพาณิชย์ในโครงการ โนเบิล โซโล,http://www.aimcgreit.com,https://weblink.set.or.th/dat/f56/0188ONE260320241928370253T.zip
SET,PF&REIT,AIMIRT,ทรัสต์เพื่อการลงทุนในอสังหาริมทรัพย์และสิทธิการเช่าอสังหาริมทรัพย์ เอไอเอ็ม อินดัสเทรียล โกรท,ลงทุนในกรรมสิทธิ์ สิทธิการเช่า และสิทธิการเช่าช่วงในที่ดิน อาคารคลังสินค้า อาคารคลังห้องเย็น และถังเก็บสารเคมีเหลว รวมถึงอสังหาริมทรัพย์อื่นใดที่เกี่ยวข้องกับอสังหาริมทรัพย์ที่กองทรัสต์เข้าลงทุน,http://www.aimirt.com,https://weblink.set.or.th/dat/f56/0188ONE260320241928370253T.zip
SET,PF&REIT,ALLY,ทรัสต์เพื่อการลงทุนในสิทธิการเช่าอสังหาริมทรัพย์ อัลไล,ลงทุนในสิทธิการเช่า/เช่าช่วงในศูนย์การค้า 13 โครงการ ได้แก่ 1. คริสตัล ดีไซน์ เซ็นเตอร์ 2. เดอะ คริสตัล เอกมัย-รามอินทรา 3. เดอะ คริสตัล เอสบี ราชพฤกษ์ 4. อมอรินี่ 5. แอมพาร์ค 6. เพลินนารี่ มอลล์ 7. สัมมากรเพลส รามคำแหง 8. สัมมากรเพลส รังสิต 9. สัมมากรเพลส ราชพฤกษ์ 10. เดอะ ซีน 11. กาดฝรั่ง วิลเลจ 12. เดอะ คริสตัล ชัยพฤกษ์ 13. เดอะ ไพร์ม หัวลำโพง,http://www.allyreit.com,https://weblink.set.or.th/dat/f56/0188ONE260320241928370253T.zip
SET,PF&REIT,AMATAR,ทรัสต์เพื่อการลงทุนในอสังหาริมทรัพย์และสิทธิการเช่าอมตะซัมมิทโกรท,ลงทุนในกรรมสิทธิ์และสิทธิการเช่าในอสังหาริมทรัพย์ประเภทอาคารโรงงานจำนวน 88 อาคาร ที่ตั้งอยู่ในนิคมอุตสาหกรรมอมตะ ซิตี้ ชลบุรี และนิคมอุตสาหกรรมอมตะ ซิตี้ ระยอง,http://www.amatareit.com,https://weblink.set.or.th/dat/f56/0188ONE260320241928370253T.zip
SET,PF&REIT,B-WORK,ทรัสต์เพื่อการลงทุนในสิทธิการเช่าอสังหาริมทรัพย์บัวหลวง ออฟฟิศ,ลงทุนในสิทธิการเช่าอาคารสำนักงานและพื้นที่เกี่ยวข้องของโครงการทรู ทาวเวอร์ 1 และทรู ทาวเวอร์ 2 ระยะเวลา 30 ปี,http://www.bworkreit.com,https://weblink.set.or.th/dat/f56/0188ONE260320241928370253T.zip
SET,PF&REIT,BAREIT,ทรัสต์เพื่อการลงทุนในสิทธิการเช่าอสังหาริมทรัพย์สนามบินการบินกรุงเทพ,ลงทุนในสิทธิการเช่าที่ดิน สิ่งปลูกสร้าง และส่วนควบของทรัพย์สินบางส่วนที่ใช้ในการดำเนินงานสนามบิน ภายในโครงการสนามบินสมุย,http://www.bareit.co.th,https://weblink.set.or.th/dat/f56/0188ONE260320241928370253T.zip
SET,PF&REIT,BKKCP,กองทุนรวมอสังหาริมทรัพย์บางกอก,กองทุนลงทุนในกรรมสิทธิ์ (freehold) ห้องชุดสำนักงานและห้องชุดพาณิชยกรรมในอาคารชาญอิสสระ ทาวเวอร์ ถนนพระราม 4 และ อาคารชาญอิสสระ ทาวเวอร์ 2 ถนนเพชรบุรีตัดใหม่,,https://weblink.set.or.th/dat/f56/0188ONE260320241928370253T.zip
SET,PF&REIT,BOFFICE,ทรัสต์เพื่อการลงทุนในสิทธิการเช่าอสังหาริมทรัพย์ภิรัชออฟฟิศ,ลงทุนในสิทธิการเช่าอาคารสำนักงานภิรัชทาวเวอร์ แอท เอ็มควอเทียร์ และกรรมสิทธิ์ในสังหาริมทรัพย์ที่เกี่ยวข้องกับการดำเนินงานของสำนักงาน โดยมีระยะเวลาการเช่าประมาณ 26 ปี 9 เดือน นับแต่วันที่จดทะเบียนการเช่า  ลงทุนในสิทธิการเช่าอาคารสำนักงานภิรัชทาวเวอร์ แอท ไบเทค และกรรมสิทธิ์ในสังหาริมทรัพย์ที่เกี่ยวข้องกับการดำเนินงานของสำนักงาน โดยมีระยะเวลาการเช่า 30 ปี นับแต่วันที่จดทะเบียนการเช่า,http://www.bofficereit.com,https://weblink.set.or.th/dat/f56/0188ONE260320241928370253T.zip
SET,PF&REIT,CPNCG,กองทุนรวมสิทธิการเช่าอสังหาริมทรัพย์ CPN คอมเมอร์เชียล โกรท,"ลงทุนในสิทธิการเช่า (leasehold) ที่ดินพร้อมอาคารสำนักงาน ดิ ออฟฟิศเศส แอท เซ็นทรัล เวิลด์ (ยกเว้น พื้นที่บางส่วนของชั้น G และชั้น 3 และพื้นที่ชั้นใต้ดิน B1-B3) และสิทธิในการใช้บริการพื้นที่จอดรถจำนวน 1,271 คัน รวมทั้งการซื้อทรัพย์สินที่เกี่ยวข้องบนสิทธิการเช่าดังกล่าว",http://www.cpncg.com,https://weblink.set.or.th/dat/f56/0188ONE260320241928370253T.zip
SET,PF&REIT,CPNREIT,ทรัสต์เพื่อการลงทุนในสิทธิการเช่าอสังหาริมทรัพย์ CPN รีเทล โกรท,ลงทุนในกรรมสิทธิ และ/หรือ สิทธิการเช่า และ/หรือ สิทธิการเช่าช่วง ในโครงการเซ็นทรัล พระราม 2 โครงการเซ็นทรัล พระราม 3 โครงการเซ็นทรัล ปิ่นเกล้าและอาคารสำนักงานปิ่นเกล้า ทาวเวอร์เอ และบี โครงการเซ็นทรัล เชียงใหม่ แอร์พอร์ต โครงการเซ็นทรัล พัทยาและโรงแรมฮิลตัน พัทยา โครงการอาคารสำนักงานเดอะไนน์ ทาวเวอร์ส โครงการอาคารสำนักงานยูนิลีเวอร์ เฮ้าส์ โครงการเซ็นทรัล มารีนา และโครงการเซ็นทรัล ลำปาง,http://www.cpnreit.com,https://weblink.set.or.th/dat/f56/0188ONE260320241928370253T.zip
SET,PF&REIT,CPTGF,กองทุนรวมสิทธิการเช่าอสังหาริมทรัพย์ ซี.พี.ทาวเวอร์ โกรท,ลงทุนในสิทธิการเช่า (leasehold) ในที่ดินและอาคารสำนักงานและศูนย์การค้า รวมถึงส่วนควบของที่ดินและอาคาร งานระบบที่จำเป็นต่อการใช้ประโยชน์ในอาคาร จำนวน 3 อาคาร โดยสิทธิการเช่ามีกำหนดระยะเวลา 30 ปีแต่วันจดทะเบียนการเช่าที่สำนักงานที่ดิน (ลงทุนวันที่ 4 ธ.ค.56) ได้แก่ 1) อาคารซี.พี.ทาวเวอร์ 1 (สีลม) เป็นอาคารสำนักงานให้เช่าสำหรับลูกค้าทั่วไปและบริษัทในเครือเจริญโภคภัณฑ์ 2) อาคาร ซี.พี.ทาวเวอร์ 2 (ฟอร์จูนทาวน์) เป็นอาคารเพื่อการพาณิชย์ขนาดใหญ่ ประกอบด้วยอาคารสำนักงาน และอาคารศูนย์การค้าฟอร์จูนทาวน์ 3) อาคาร ซี.พี. ทาวเวอร์ 3 (พญาไท) เป็นอาคารสำนักงานให้เช่าสำหรับลูกค้าทั่วไป,http://www.ktam.co.th,https://weblink.set.or.th/dat/f56/0188ONE260320241928370253T.zip
SET,PF&REIT,CTARAF,กองทุนรวมสิทธิการเช่าอสังหาริมทรัพย์โรงแรมและรีสอร์ทในเครือฯ,ลงทุนในสิทธิการเช่าอสังหาริมทรัพย์ (leasehold) โครงการ โรงแรมเซ็นทารา แกรนด์ บีช รีสอร์ท สมุย,,https://weblink.set.or.th/dat/f56/0188ONE260320241928370253T.zip
SET,PF&REIT,DREIT,ทรัสต์เพื่อการลงทุนในอสังหาริมทรัพย์และสิทธิการเช่าดุสิตธานี,กองทรัสต์เพื่อการลงทุนในอสังหาริมทรัพย์และสิทธิการเช่าดุสิตธานี,http://www.dtcreit.com,https://weblink.set.or.th/dat/f56/0188ONE260320241928370253T.zip
SET,PF&REIT,ERWPF,กองทุนรวมอสังหาริมทรัพย์เอราวัณ โฮเทล โกรท,ลงทุนในกรรมสิทธิ์ (freehold) โรงแรมไอบิส ป่าตอง และ โรงแรมไอบิส พัทยา ซึ่งทรัพย์สินดังกล่าวประกอบด้วยที่ดินพร้อมสิ่งปลูกสร้างอาคาร งานระบบสาธารณูปโภคที่เกี่ยวข้องกับกิจการโรงแรม และเฟอร์นิเจอร์ ทรัพย์สินติดตรึงตรา และอุปกรณ์ต่างๆ,http://www.scbam.com,https://weblink.set.or.th/dat/f56/0188ONE260320241928370253T.zip
SET,PF&REIT,FTREIT,ทรัสต์เพื่อการลงทุนในอสังหาริมทรัพย์และสิทธิการเช่าอสังหาริมทรัพย์เพื่ออุตสาหกรรม เฟรเซอร์ส พร็อพเพอร์ตี้,ลงทุนในกรรมสิทธิ์ (Freehold) และสิทธิการเช่า (Leasehold) ในอสังหาริมทรัพย์ประเภทอาคารคลังสินค้า และอาคารโรงงาน,http://www.ftreit.co.th,https://weblink.set.or.th/dat/f56/0188ONE260320241928370253T.zip
SET,PF&REIT,FUTUREPF,กองทุนรวมสิทธิการเช่าอสังหาริมทรัพย์ฟิวเจอร์พาร์ค,ลงทุนในสิทธิการเช่าพื้นที่บางส่วน (leasehold) ของศูนย์การค้าฟิวเจอร์พาร์ค รังสิต ประกอบด้วยพื้นที่ร้านค้าและพื้นที่ส่วนกลางทั้งหมดในศูนย์การค้าฯ รวมถึงพื้นที่ผนังภายนอกอาคารออกหาประโยชน์,http://investor.futurepark.co.th,https://weblink.set.or.th/dat/f56/0188ONE260320241928370253T.zip
SET,PF&REIT,GAHREIT,ทรัสต์เพื่อการลงทุนในอสังหาริมทรัพย์ แกรนด์ โฮสพีทาลิตี้,GAHREIT ลงทุนในกรรมสิทธิ์ที่ดิน อาคาร สิ่งปลูกสร้าง และสังหาริมทรัพย์ที่ใช้ในการดำเนินโครงการโรงแรม เชอราตัน หัวหิน รีสอร์ท แอนด์ สปา,http://www.one-asset.com,https://weblink.set.or.th/dat/f56/0188ONE260320241928370253T.zip
SET,PF&REIT,GROREIT,ทรัสต์เพื่อการลงทุนในอสังหาริมทรัพย์ แกรนด์ รอยัล ออคิด โฮสพีทาลิตี้ ที่มีข้อตกลงในการซื้อคืน,ลงทุนในกรรมสิทธิ์ของโรงแรมรอยัล ออคิด เชอราตัน โฮเทล แอนด์ ทาวเวอร์ส โดยบริษัท โรงแรมรอยัล ออคิด (ประเทศไทย) จำกัด (มหาชน) (ROH) ซึ่งเป็นเจ้าของเดิมของทรัพย์สินจะเป็นผู้เช่าและผู้ซื้อคืนทรัพย์สิน มีระยะเวลาการเช่า 3 ปี และเช่าต่ออีก 2 คราว คราวละ 1 ปี โดยมีข้อกำหนดในการขายทรัพย์สินคืนให้แก่ ROH เมื่อสิ้นสุดปีการเช่าที่ 3-5,http://www.one-asset.com,https://weblink.set.or.th/dat/f56/0188ONE260320241928370253T.zip
