market,sector,symbol,symbol_name,description,link_website,one_report_link
SET,FIN,UOBKH,บริษัทหลักทรัพย์ ยูโอบี เคย์เฮียน (ประเทศไทย) จำกัด (มหาชน),ธุรกิจหลักทรัพย์ 4 ประเภท ได้แก่ นายหน้าซื้อขายหลักทรัพย์ ค้าหลักทรัพย์ จัดจำหน่ายหลักทรัพย์ และที่ปรึกษาการลงทุนธุรกิจสัญญาซื้อขายล่วงหน้าธุรกิจที่ปรึกษาทางการเงินธุรกิจตัวแทนสนับสนุนการขายและรับซื้อคืนหน่วยลงทุน และผู้แทนผู้ถือหุ้นกู้,https://www.utrade.co.th/,https://weblink.set.or.th/dat/f56/0870ONE190420241415130194T.zip
SET,FIN,XPG,บริษัท เอ็กซ์สปริง แคปปิตอล จำกัด (มหาชน),ธุรกิจการลงทุนในธุรกิจอื่นๆ ที่มีศักยภาพ,http://www.xspringcapital.com,https://weblink.set.or.th/dat/f56/0472ONE270320240938230908T.zip
SET,INSUR,AYUD,บริษัท อลิอันซ์ อยุธยา แคปปิตอล จำกัด (มหาชน),ลงทุนในบริษัทอื่น โดยเน้นการลงทุนในธุรกิจประกันภัย,http://www.ayud.co.th,https://weblink.set.or.th/dat/f56/0093ONE260320241006400391T.zip
SET,INSUR,BKI,บริษัท กรุงเทพประกันภัย จำกัด (มหาชน),ธุรกิจด้านรับประกันวินาศภัยอันได้แก่ การประกันอัคคีภัย ประกันภัยทางทะเลและขนส่ง ประกันภัยยานยนต์    ประกันภัยเบ็ดเตล็ด รวมทั้งการรับประกันภัยต่อ,http://www.bangkokinsurance.com,https://weblink.set.or.th/dat/f56/0042ONE010420241255440499T.zip
SET,INSUR,BLA,บริษัท กรุงเทพประกันชีวิต จำกัด (มหาชน),บริษัท กรุงเทพประกันชีวิต จำกัด (มหาชน) ดำเนินธุรกิจประกันชีวิตและบริการวางแผนทางการเงินอย่างรอบด้าน โดยการประกันชีวิตเป็นวิธีการที่บุคคลกลุ่มหนึ่งร่วมกันเฉลี่ยภัยอันเนื่องจากการเสียชีวิต การสูญเสียอวัยวะ ทุพพลภาพ และการสูญเสียรายได้ในยามชรา เมื่อบุคคลใดต้องประสบกับภัยเหล่านั้น จะได้รับเงินตามเงื่อนไขข้อตกลงที่ตกลงกันไว้ เพื่อบรรเทาความเดือดร้อนแก่ตนเองและครอบครัว โดยบริษัทจะจ่ายให้แก่ผู้ประสบภัยหรือผู้รับผลประโยชน์,http://www.bangkoklife.com,https://weblink.set.or.th/dat/f56/1016ONE270320241250520095T.zip
SET,INSUR,BUI,บริษัท บางกอกสหประกันภัย จำกัด (มหาชน),ธุรกิจประกันวินาศภัย,http://www.bui.co.th,https://weblink.set.or.th/dat/f56/0139ONE280320242050440641T.zip
SET,INSUR,CHARAN,บริษัท จรัญประกันภัย จำกัด (มหาชน),ธุรกิจประกันวินาศภัย,http://www.charaninsurance.com,https://weblink.set.or.th/dat/f56/0321ONE010420241638100079T.zip
SET,INSUR,INSURE,บริษัท อินทรประกันภัย จำกัด (มหาชน),รับประกันวินาศภัยทุกประเภท คือ อัคคีภัย ภัยทางทะเลและขนส่ง รถยนต์และอุบัติเหตุเบ็ดเตล็ด,http://https:www.indara.co.th,https://weblink.set.or.th/dat/f56/0217ONE290320241358150583T.zip
SET,INSUR,KWI,บริษัท เคดับบลิวไอ จำกัด (มหาชน),ธุรกิจประกันชีวิต ธุรกิจประกันวินาศภัย ธุรกิจบริหารจัดการสินทรัพย์ และธุรกิจพัฒนาอสังหาริมทรัพย์,http://www.kwiasia.com,https://weblink.set.or.th/dat/f56/0323ONE210320241938230362T.zip
SET,INSUR,MTI,บริษัท เมืองไทยประกันภัย จำกัด (มหาชน),รับประกันวินาศภัย ได้แก่ การรับประกันอัคคีภัย การรับประกันภัยทางทะเลและขนส่ง การรับประกันภัยรถยนต์ และการรับประกันภัยเบ็ดเตล็ด,http://www.muangthaiinsurance.com,https://weblink.set.or.th/dat/f56/0985ONE260320240843380154T.zip
SET,INSUR,NKI,บริษัท นวกิจประกันภัย จำกัด (มหาชน),ประกันวินาศภัย,http://www.navakij.co.th,https://weblink.set.or.th/dat/f56/0199ONE190320241848490578T.zip
SET,INSUR,SMK,บริษัท สินมั่นคงประกันภัย จำกัด (มหาชน),รับประกันวินาศภัย 4 ประเภท ได้แก่ 1) การประกันภัยทางรถยนต์ 2) การประกันอัคคีภัย 3) การประกันภัยทางทะเลและขนส่ง 4) การประกันภัยเบ็ดเตล็ด,http://www.smk.co.th,https://weblink.set.or.th/dat/f56/F0239B22.zip
SET,INSUR,TGH,บริษัท ไทยกรุ๊ป โฮลดิ้งส์ จำกัด (มหาชน),TGH  ประกอบธุรกิจโดยการถือหุ้นในบริษัทอื่น (Holding Company) ซึ่งประกอบธุรกิจประกันชีวิต ธุรกิจประกันภัย และธุรกิจการเงิน (ลีสซิ่งและสินเชื่อองค์กร) โดยมีบริษัท อาคเนย์ประกันชีวิต จำกัด (มหาชน) (SE Life) ประกอบธุรกิจประกันชีวิต เป็นบริษัทย่อยที่ประกอบธุรกิจหลักซึ่งก่อให้เกิดกำไรหลัก,https://www.tgh.co.th,https://weblink.set.or.th/dat/f56/1500ONE270320241905220260T.zip
SET,INSUR,THRE,บริษัท ไทยรับประกันภัยต่อ จำกัด (มหาชน),ให้บริการด้านการรับประกันภัยต่อ (Professional Reinsurer) ครอบคลุมทั้งการรับประกันภัยทรัพย์สิน อุบัติเหตุ วิศวกรรม ภัยทางทะเลและการขนส่งสินค้า ลูกค้าของบริษัทส่วนใหญ่เป็นบริษัทประกันวินาศภัยในประเทศ  มีเพียงบางส่วนเป็นลูกค้าจากตลาดต่างประเทศ,http://www.thaire.co.th,https://weblink.set.or.th/dat/f56/0322ONE250320241745330265T.zip
SET,INSUR,THREL,บริษัท ไทยรีประกันชีวิต จำกัด (มหาชน),บริษัทฯ ประกอบธุรกิจประกันภัยต่อด้านการประกันชีวิตทุกประเภท โดยเบี้ยประกันภัยรับส่วนหนึ่งจะถูกกันไว้เป็นเงินสำรองประกันชีวิต และดำเนินการบริหารเงินสำรองประกันชีวิตส่วนนี้โดยนำไปลงทุนเพื่อสร้างผลตอบแทนให้ครอบคลุมภาระที่จะเกิดขึ้น,http://www.thairelife.co.th,https://weblink.set.or.th/dat/f56/1153ONE250320241448170122B.zip
SET,INSUR,TIPH,บริษัท ทิพย กรุ๊ป โฮลดิ้งส์ จำกัด (มหาชน),TIPH ประกอบธุรกิจโดยการถือหุ้นในบริษัทอื่น (Holding Company) โดยมีบริษัท ทิพยประกันภัย จำกัด (มหาชน) ซึ่งประกอบธุรกิจประกันภัย เป็นบริษัทย่อยที่ประกอบธุรกิจหลัก,http://www.dhipayagroup.co.th,https://weblink.set.or.th/dat/f56/1654ONE010420242159330760T.zip
SET,INSUR,TLI,บริษัท ไทยประกันชีวิต จำกัด (มหาชน),ธุรกิจประกันชีวิต,http://www.thailife.com,https://weblink.set.or.th/dat/f56/1697ONE290320241619220452T.zip
SET,INSUR,TQM,บริษัท ทีคิวเอ็ม อัลฟา จำกัด (มหาชน),"ประกอบธุรกิจโดยการถือหุ้นในบริษัทอื่น (Holding Company) ที่ประกอบธุรกิจหลักในการให้บริการนายหน้าประกันภัย ดังต่อไปนี้1. กลุ่มธุรกิจนายหน้าประกัน แบ่งเป็นธุรกิจนายหน้าประกันวินาศภัย ได้แก่ บริษัท ทีคิวเอ็ม อินชัวร์รันส์ โบรคเกอร์ จำกัด, บริษัท ที เจ เอ็น อินชัวร์รันส์โบรกเกอร์ จำกัด และบริษัท ทรู เอกซ์ตร้า โบรกเกอร์ จำกัด, ธุรกิจนายหน้าประกันชีวิต ได้แก่ บริษัท ทีคิวเอ็ม ไลฟ์ อินชัวร์รันส์ โบรคเกอร์ จำกัด และบริษัท ทรู ไลฟ์ โบรกเกอร์ จำกัด, ธุรกิจนายหน้าประกันภัยต่อ ได้แก่ บริษัท ที คิว อาร์ จำกัด (มหาชน), บริษัทย่อยที่สนับสนุนธุรกิจหลัก ได้แก่ บริษัท ทีโอ 2020 จำกัด (ลงทุนในต่างประเทศ), บริษัท แคสแมท จำกัด (บริการด้านเทคโนโลยีสารสนเทศและซอฟต์แวร์), บริษัท ทีคิวซี จำกัด (บริหารจัดการสินไหมประกันสุขภาพ/อุบัติเหตุ)2. กลุ่มธุรกิจการเงิน ประกอบด้วย ธุรกิจสินเชื่อส่วนบุคคล ได้แก่ บริษัท อีซี่ เลนดิ้ง จำกัด, ธุรกิจสินเชื่อแบบมีหลักประกัน ได้แก่ บริษัท แคชนาว พลัส จำกัด 3. กลุ่มธุรกิจเทคโนโลยีแพลตฟอร์ม ได้แก่ บริษัท ชัวร์ครับ.คอม จำกัด, บริษัท ทีคิวดี จำกัด และบริษัท บิลค์ วัน กรุ๊ป จำกัด",http://www.tqmcorp.co.th,https://weblink.set.or.th/dat/f56/1468ONE250320242152410098T.zip
SET,INSUR,TSI,บริษัท ไทยเศรษฐกิจประกันภัย จำกัด (มหาชน),ให้บริการรับประกันวินาศภัยเป็นหลัก ได้แก่ อัคคีภัย การขนส่งสินค้าทางทะเล รถยนต์ เบ็ดเตล็ด และมีธุรกิจการลงทุนในหลักทรัพย์และตราสารทางการเงินประเภทต่างๆ,http://www.tsi.co.th,https://weblink.set.or.th/dat/f56/0220ONE010420242205070196T.zip
SET,INSUR,TVH,บริษัท ไทยวิวัฒน์ โฮลดิ้งส์ จำกัด (มหาชน),TVH ประกอบธุรกิจหลักโดยการถือหุ้นในบริษัทอื่น (Holding Company) ซึ่งมีธุรกิจหลักคือ ธุรกิจประกันภัย ประกอบด้วย ธุรกิจประกันวินาศภัยในประเทศไทย ธุรกิจประกันภัยในต่างประเทศ และธุรกิจที่เกี่ยวข้องกับธุรกิจประกันภัย,https://thaivivatholdings.com,https://weblink.set.or.th/dat/f56/1829ONE010420241449220233T.zip
SET,AUTO,3K-BAT,บริษัท ไทย เอ็นเนอร์จี สโตเรจ เทคโนโลยี จำกัด (มหาชน),ผลิตและจำหน่ายแบตเตอรี่หลากหลายรูปแบบ ได้แก่ 1) แบตเตอรี่สำหรับรถยนต์ 2) แบตเตอรี่สำหรับรถจักรยานยนต์ 3) แบตเตอรี่สำหรับรถฟอล์คลิฟท์ 4) แบตเตอรี่สำหรับรถกอล์ฟ 5) แบตเตอรี่สำหรับโซลาร์เซลล์ และ 6) แบตเตอรี่แสงสว่าง,,https://weblink.set.or.th/dat/f56/F1604T23.zip
SET,AUTO,ACG,บริษัท ออโตคอร์ป โฮลดิ้ง จำกัด (มหาชน),บริษัท ออโตคอร์ป โฮลดิ้ง จำกัด (มหาชน) (?บริษัท?) ประกอบธุรกิจโดยการถือหุ้นในบริษัทอื่น (Holding company) ที่ประกอบธุรกิจจำหน่ายและให้บริการในอุตสาหกรรมรถยนต์ และธุรกิจที่เกี่ยวเนื่องอื่นๆ ปัจจุบัน บริษัทมีการลงทุนในบริษัทย่อย 2 แห่ง ดังนี้ 1. บริษัท ฮอนด้ามะลิวัลย์ จำกัด (?ฮอนด้ามะลิวัลย์?) เป็นบริษัทผู้จำหน่ายและศูนย์บริการรถยนต์ยี่ห้อฮอนด้า 2. บริษัท ออโตคลิกบายเอซีจี จำกัด (?ออโตคลิก?) ประกอบธุรกิจเป็นศูนย์บริการรถยนต์ทุกยี่ห้อประเภทเร่งด่วน (Fast Fit),http://www.autocorpgroup.com,https://weblink.set.or.th/dat/f56/1474ONE270320241335080525T.zip
SET,AUTO,AH,บริษัท อาปิโก ไฮเทค จำกัด (มหาชน),ธุรกิจหลักของบริษัท ประกอบด้วย ธุรกิจผลิตชิ้นส่วนยานยนต์ ธุรกิจตัวแทนจำหน่ายรถยนต์และศูนย์บริการหลังการขาย  และธุรกิจให้บริการด้านเทคโนโลยี การเชื่อมต่อ และ IoT (Internet of Things),http://www.aapico.com,https://weblink.set.or.th/dat/f56/0688ONE270320241717040013T.zip
SET,AUTO,CWT,บริษัท ชัยวัฒนา แทนเนอรี่ กรุ๊ป จำกัด (มหาชน),บริษัทได้ประกอบธุรกิจหลัก 3 กลุ่มธุรกิจคือ 1.กลุ่มผลิตภัณฑ์หนัง ผลิตและจำหน่ายผลิตภัณฑ์ 4 ประเภท ได้แก่ 1) ผลิตภัณฑ์หนังสัตว์ฟอก 2) ผลิตภัณฑ์ของเล่นสัตว์เลี้ยง 3) ผลิตภัณฑ์เฟอร์นิเจอร์หนัง 4) ผลิตภัณฑ์เบาะหนังและชิ้นส่วนหนังสำหรับรถยนต์ เช่น Toyota Honda Nissan Isuzu Mazda Mitsubishi และ Chevrolet 2กลุ่มพลังงาน โดยบริษัทได้ลงทุนซื้อหุ้นในบริษัท ชัยวัฒนา กรีน จำกัด ในสัดส่วน 100% โดยมีเป้าหมายเพื่อประกอบธุรกิจลงทุน (ถือหุ้น) บริษัท ในกลุ่มพลังงานทดแทน 3.กลุ่มออกแบบและจัดจำหน่ายยานพาหนะ ซึ่งประกอบกิจการออกแบบและจัดจำหน่ายเรือ และรถโดยสารขนาด เล็กที่ผลิตด้วยอลูมิเนียม,http://www.cwt.co.th,https://weblink.set.or.th/dat/f56/0225ONE280320241019500742T.zip
SET,AUTO,EASON,บริษัท อีซึ่น แอนด์ โค จำกัด (มหาชน),ผลิตและจำหน่ายสีอุตสาหกรรม ได้แก่ สีพ่นรถจักรยานยนต์ หมึกพิมพ์ บรรจุภัณฑ์  สีเคลือบบรรจุภัณฑ์  สีอุตสาหกรรมอื่นๆ และ การลงทุน,http://www.easonplc.com,https://weblink.set.or.th/dat/f56/0861ONE290320240936370239T.zip
SET,AUTO,GYT,บริษัท กู๊ดเยียร์(ประเทศไทย) จำกัด (มหาชน),ผลิตและจำหน่ายยางรถยนต์และยางเครื่องบิน การหล่อดอกยางเครื่องบินสำหรับตลาดในประเทศและเพื่อการส่งออก,http://www.goodyear.co.th,https://weblink.set.or.th/dat/f56/0034ONE290320241916360369T.zip
SET,AUTO,HFT,บริษัท ฮั้วฟง รับเบอร์ (ไทยแลนด์) จำกัด (มหาชน),ผลิตและจำหน่ายยางนอกและยางในสำหรับรถจักรยาน รถจักรยานยนต์ และรถขนส่งขนาดเล็ก,http://www.duro.co.th,https://weblink.set.or.th/dat/f56/0755ONE290320241625070320T.zip
SET,AUTO,IHL,บริษัท อินเตอร์ไฮด์ จำกัด (มหาชน),กลุ่มบริษัท อินเตอร์ไฮด์ จำกัด(มหาชน) ประกอบธุรกิจผลิตและจัดจำหน่ายหนังสำหรับเบาะรถยนต์ หนังหุ้มเบาะรถยนต์ หัวเกียร์ และพวงมาลัยรถยนต์ ชิ้นงานหนังตัดขึ้นรูป เฟอร์นิเจอร์ รองเท้า โดยใช้หนังโค กระบือและสุกรโดยผ่านกรรมวิธีการฟอกย้อมและนำมาตัดหรือเย็บเป็นผลิตภัณฑ์ ด้วยเครื่องมือเครื่องจักรอันทันสมัย รวมถึงการนำวัตถุคงเหลือมารีไซเคลเป็นโปรตีนเพื่ออุตสาหกรรมและการเกษตร,http://www.interhides.com,https://weblink.set.or.th/dat/f56/0886ONE270320242200280130T.zip
SET,AUTO,INGRS,บริษัท อิงเกรส อินดัสเตรียล (ไทยแลนด์) จำกัด (มหาชน),เป็นบริษัทประกอบธุรกิจโดยการถือหุ้นในบริษัท ที่ดำเนินธุรกิจผลิตและจำหน่ายชิ้นส่วนรถยนต์ ในประเทศไทย มาเลเซีย อินโดนีเซีย และอินเดีย โดยมีบริษัท อิงเกรส ออโตเวนเจอร์ จำกัด เป็นบริษัทแกน ที่ประกอบธุรกิจดังกล่าวในประเทศไทย,http://www.ingress.co.th,https://weblink.set.or.th/dat/f56/1338ONE300420241650330110T.zip
SET,AUTO,IRC,บริษัท อีโนเว รับเบอร์ (ประเทศไทย) จำกัด (มหาชน),ประกอบธุรกิจด้านการผลิตผลิตภัณฑ์ยางอีลาสโตเมอร์ เพื่อใช้ในอุตสาหกรรมยานยนต์และอุตสาหกรรมอื่นๆ และธุรกิจด้านการผลิตยางนอก-ยางในของรถจักรยานยนต์ที่มีคุณภาพสูงมาตรฐานโลก,http://www.ircthailand.com,https://weblink.set.or.th/dat/f56/0437ONE281220230932200126T.zip
SET,AUTO,MGC,บริษัท มิลเลนเนียม กรุ๊ป คอร์ปอเรชั่น (เอเชีย) จำกัด (มหาชน),บริษัทประกอบธุรกิจโดยการถือหุ้นในบริษัทอื่น (Holding Company) ที่ประกอบธุรกิจอย่างครบวงจรในอุตสาหกรรมยานยนต์ ซึ่งประกอบด้วย 1.) กลุ่มธุรกิจจำหน่ายยานยนต์ 2.) กลุ่มธุรกิจให้บริการหลังการขายและให้บริการซ่อมบำรุงรถยนต์อิสระ 3.) กลุ่มธุรกิจให้บริการเช่ารถยนต์และคนขับ และ 4.) กลุ่มธุรกิจให้บริการด้านเทคโนโลยีสารสนเทศ (IT) บริการบริหารจัดการ (Shared Service) บริการทางการเงินสำหรับยานยนต์ นายหน้าประกันภัย และบริการทำความสะอาดและเคลือบสีรถยนต์,https://www.mgc-asia.com,https://weblink.set.or.th/dat/f56/1754ONE290320242115320574T.zip
SET,AUTO,NEX,บริษัท เน็กซ์ พอยท์ จำกัด (มหาชน),1. ผลิตและรับจ้างผลิตชิ้นส่วนอิเล็คทรอนิกส์ตามคำสั่งซื้อของลูกค้า 2.จำหน่าย/ให้เช่ารถบัสโดยสาร ซ่อมบำรุง จำหน่ายอะไหล่รถบัสโดยสาร   3.ลงทุนในบริษัทย่อย,http://www.nexpoint.co.th,https://weblink.set.or.th/dat/f56/0825ONE010420241319100317T.zip
