market,sector,symbol,symbol_name,description,link_website,one_report_link
SET,COMM,FN,บริษัท เอฟเอ็น แฟคตอรี่ เอ๊าท์เลท จำกัด (มหาชน),ดำเนินธุรกิจศูนย์จัดจำหน่ายสินค้า ประเภท ?เอ๊าท์เลท? โดยสินค้าที่วางจำหน่ายเป็นสินค้าที่อยู่ภายใต้ตราสินค้าของบริษัทเป็นส่วนใหญ่ ซึ่งบริษัทจัดหาผ่านการสั่งผลิตจากผู้ผลิตสินค้าทั้งภายในและต่างประเทศโดยตรง และตราสินค้าอื่นๆ ซึ่งบริษัทรับซื้อเพื่อมาวางจำหน่าย โดยสินค้าที่วางจำหน่ายมีความหลากหลาย และสามารถตอบสนองความต้องการซื้อของผู้ซื้อในทุกเพศทุกวัย,http://www.fnoutlet.com,https://weblink.set.or.th/dat/f56/1341ONE010420241703560224T.zip
SET,COMM,FTE,บริษัท ไฟร์เทรดเอ็นจิเนียริ่ง จำกัด (มหาชน),นำเข้าและจัดจำหน่ายอุปกรณ์ดับเพลิงแบบครบวงจร ระบบดับเพลิงอัตโนมัติ ระบบสัญญาณแจ้งเหตุเพลิงไหม้ รวมถึงการให้บริการออกแบบ รับเหมา ติดตั้งระบบดับเพลิง และระบบสัญญาณแจ้งเหตุเพลิงไหม้,http://www.firetrade.co.th,https://weblink.set.or.th/dat/f56/1374ONE270320241047590753T.zip
SET,COMM,GLOBAL,บริษัท สยามโกลบอลเฮ้าส์ จำกัด (มหาชน),เป็นศูนย์จำหน่ายสินค้าวัสดุก่อสร้าง วัสดุตกแต่ง เครื่องมือ อุปกรณ์ที่ใช้ในงานก่อสร้าง ต่อเติม ตกแต่ง บ้านและสวนแบบควบวงจร (one stop shopping center) โดยใช้ชื่อทางการค้าว่า โกลบอล เฮ้าส์ (Global House) โดยนำระบบ Drive-through มาใช้เพื่อเพิ่มความสะดวกในการรับสินค้าโครงสร้างของลูกค้า,http://www.globalhouse.co.th,https://weblink.set.or.th/dat/f56/0991ONE060320241818330580T.zip
SET,COMM,HMPRO,บริษัท โฮม โปรดักส์ เซ็นเตอร์ จำกัด (มหาชน),จำหน่ายสินค้าและให้บริการที่เกี่ยวข้องกับการก่อสร้าง ตกแต่ง ต่อเติม ซ่อมแซม ปรับปรุง อาคาร บ้าน และที่อยู่อาศัยแบบครบวงจร,http://www.homepro.co.th,https://weblink.set.or.th/dat/f56/0661ONE200320241819520968T.zip
SET,COMM,ICC,บริษัท ไอ.ซี.ซี. อินเตอร์เนชั่นแนล จำกัด (มหาชน),จำหน่ายสินค้าแฟชั่นในประเทศและต่างประเทศ ได้แก่ เครื่องสำอางและเครื่องหอม  สินค้าเพื่อสุขอนามัยของเส้นผม  ผิวพรรณ  สิ่งทอและเครื่องนุ่งห่มครบวงจร  ทั้งชุดชั้นใน  ชุดชั้นนอก ชุดกีฬา และการออกกำลังกาย ผลิตภัณฑ์เพื่อการซักล้างและบำรุงรักษาเครื่องนุ่งห่ม สินค้าแฟชั่นเครื่องหนัง เป็นต้น,http://www.icc.co.th,https://weblink.set.or.th/dat/f56/0046ONE250320242109190746T.zip
SET,COMM,ILM,บริษัท อินเด็กซ์ ลิฟวิ่งมอลล์ จำกัด (มหาชน),"1.	ประกอบธุรกิจร้านค้าปลีกจำหน่ายเฟอร์นิเจอร์และของตกแต่งบ้านครบวงจรในประเทศไทย ภายใต้แบรนด์ร้านค้า ""Index Living Mall"" และแบรนด์อื่น ๆ รวมทั้งจำหน่ายสินค้าผ่านช่องทางอื่นๆ ทั้งออนไลน์และออฟไลน์ ที่ครอบคลุมลูกค้าทั้งในประเทศไทย และต่างประเทศ 2.	ประกอบธุรกิจพื้นที่ให้เช่าภายใต้รูปแบบคอมมูนิตี้มอลล์ ภายใต้แบรนด์ ""The Walk"" ""Little Walk"" และ ""Index Mall"" รวมถึงพื้นที่เช่าในสาขาของ Index Living Mall",http://www.indexlivingmall.com,https://weblink.set.or.th/dat/f56/1503ONE250320240951380859T.zip
SET,COMM,IT,บริษัท ไอที ซิตี้ จำกัด (มหาชน),"บริษัทประกอบธุรกิจค้าปลีก  (Retail Superstore) จำหน่ายเครื่องคอมพิวเตอร์ แท็บเล็ต (Tablet) อุปกรณ์ต่อพ่วง โทรศัพท์มือถือ (Smart Phone) อุปกรณ์เสริม ตลอดจนสินค้ากลุ่มใหม่ ๆ อย่าง ไอโอที และเกมมิ่ง แบบครบวงจร ภายใต้ชื่อทางการค้าว่า ""ไอที ซิตี้, ซี เอส ซี, เอซ, และ ไอที ดอท""",http://www.itcity.co.th,https://weblink.set.or.th/dat/f56/0706ONE140320241749370761T.zip
SET,COMM,KAMART,บริษัท คาร์มาร์ท จำกัด (มหาชน),"ประกอบธุรกิจนำเข้า และจัดจำหน่ายสินค้ากลุ่มผลิตภัณฑ์เครื่องสำอาง, กลุ่มผลิตภัณฑ์บำรุงผิวหน้า และผิวกาย, กลุ่มอุปกรณ์ความงาม, กลุ่มผลิตภัณฑ์อาหารเสริม และอื่นๆ",http://www.karmarts.co.th,https://weblink.set.or.th/dat/f56/0467ONE260320241749390698T.zip
SET,COMM,LOXLEY,บริษัท ล็อกซเล่ย์ จำกัด (มหาชน),ประเภทธุรกิจ : ธุรกิจหลักของบริษัท แบ่งเป็น 5 สายธุรกิจ คือ 1) สายธุรกิจเทคโนโลยีสารสนเทศ เป็นผู้ให้บริการครบวงจรสำหรับงานเทคโนโลยีสารสนเทศและระบบคอมพิวเตอร์  2) สายธุรกิจบริการ เป็นผู้ให้บริการงานรักษาความปลอดภัยครบวงจรและการบริหารจัดการงานสนามบิน งานพัฒนาอสังหาริมทรัพย์  3) สายธุรกิจพลังงาน เป็นผู้ให้บริการครบวงจรเกี่ยวกับระบบควบคุมการทำงานของสถานีไฟฟ้า ก่อสร้างและปรับปรุงสถานีไฟฟ้า งานก่อสร้างสายส่งไฟฟ้าแรงสูง ธุรกิจเกี่ยวกับพลังงานทางเลือกและธุรกิจก่อสร้างโรงผลิตน้ำประปา  4) สายธุรกิจเน็ตเวิร์คโซลูชั่นส์ เป็นผู้จัดจำหน่ายผลิตภัณฑ์และให้บริการเกี่ยวกับ ระบบสื่อสารโทรทัศน์และวิทยุ ระบบขนส่งทางพิเศษ ผลิตภัณฑ์ก่อสร้าง และ 5) สายธุรกิจเทรดดิ้ง เป็นผู้จัดจำหน่าย ตัวแทนจำหน่าย สินค้าอุปโภคบริโภค สินค้าเคมีอุตสาหกรรม และธุรกิจร้านอาหาร,http://www.loxley.co.th,https://weblink.set.or.th/dat/f56/0376ONE270320242042020777T.zip
SET,COMM,MC,บริษัท แม็คกรุ๊ป จำกัด (มหาชน),บริษัทดำเนินธุรกิจค้าปลีกเครื่องแต่งกายและไลฟ์สไตล์ ภายใต้เครื่องหมายการค้าของกลุ่มบริษัท และเครื่องหมายการค้าของบุคคลอื่น โดยมุ่งเน้นการเป็นผู้บริหารตราสินค้า บริหารการขายและการตลาด การออกแบบ จัดหาผลิตภัณฑ์ บริหารคลังสินค้าและการกระจายสินค้า,http://www.mcgroupnet.com,https://weblink.set.or.th/dat/f56/1140ONE150520241011390132T.zip
SET,COMM,MEGA,บริษัท เมก้า ไลฟ์ไซแอ็นซ์ จำกัด (มหาชน),MEGA  เป็นบริษัทจัดจำหน่ายผลิตภัณฑ์ยา ผลิตภัณฑ์เพื่อสุขภาพและสินค้าอุปโภคบริโภค (Fast Moving Consumer Goods หรือ FMCG) ชั้นนำระดับสากล ณ ปัจจุบัน MEGA เป็นผู้จัดจำหน่ายชั้นนำในประเทศกำลังพัฒนา ได้แก่ประเทศเมียนมาร์ เวียดนาม และกัมพูชา ซึ่งประเทศดังกล่าวมีแนวโน้มการเติบโตอย่างรวดเร็ว นอกจากนี้ MEGA มีการพัฒนา ผลิต ทำการตลาด และขายผลิตภัณฑ์กลุ่มบำรุงสุขภาพ ผลิตภัณฑ์ยาตามใบสั่งแพทย์และผลิตภัณฑ์ยาจำหน่ายหน้าเคาน์เตอร์สุขภาพภายใต้เครื่องหมายการค้า Mega We CareTM  ของบริษัทผ่านเครือข่ายการจัดจำหน่ายของบริษัทและผู้จัดจำหน่ายภายนอกใน 35 ประเทศต่างๆ ทั่วโลก,http://www.megawecare.com,https://weblink.set.or.th/dat/f56/1159ONE290320241815180786T.zip
SET,COMM,MIDA,บริษัท ไมด้า แอสเซ็ท จำกัด (มหาชน),บริษัทและบริษัทย่อยดำเนินธุรกิจหลักคือการขายและให้บริการเช่าซื้อเครื่องใช้ไฟฟ้า และรถยนต์ที่ผ่านการใช้งานแล้ว โรงแรม ให้เช่าสนามกอล์ฟ ให้เช่าป้ายโฆษณา ธุรกิจพัฒนาอสังหาริมทรัพย์  บริหารจัดการทรัพย์สินที่ได้รับโอนสินทรัพย์ด้อยคุณภาพของสถาบันการเงิน และธุรกิจบริการรักษาความปลอดภัย,http://www.midaassets.com,https://weblink.set.or.th/dat/f56/0710ONE240420241501100364T.zip
SET,COMM,MOSHI,บริษัท โมชิ โมชิ รีเทล คอร์ปอเรชั่น จำกัด (มหาชน),"ธุรกิจร้านค้าปลีกสินค้าที่ตอบสนองต่อลักษณะการใช้ชีวิตประจำวันของผู้บริโภคแต่ละกลุ่ม (สินค้าไลฟ์สไตล์) ภายใต้ชื่อทางการค้า ""Moshi Moshi""",http://www.moshimoshi.co.th,https://weblink.set.or.th/dat/f56/1741ONE290320241714010129T.zip
SET,COMM,RS,บริษัท อาร์เอส จำกัด (มหาชน),บริษัทประกอบธุรกิจพาณิชย์ และ เอ็นเตอร์เทนต์เมนต์ ภายใต้โมเดล Entertainmerce โดยมีแบรนด์สินค้าและช่องทางการจัดจำหน่ายของตนเอง รวมถึงมีสื่อทั้งโทรทัศน์และวิทยุ ที่สามารถใช้ประโยชน์จาก eco-system ได้อย่างเต็มประสิทธิภาพ,http://www.rs.co.th,https://weblink.set.or.th/dat/f56/0705ONE290320241704330508T.zip
SET,COMM,RSP,บริษัท ริช สปอร์ต จำกัด (มหาชน),บริษัท ริช สปอร์ต จำกัด (มหาชน) เป็นผู้นำในการประกอบธุรกิจนำเข้า และจัดจำหน่ายสินค้าประเภทแฟชั่น และไลฟ์สไตล์ ภายใต้ตราสินค้าชั้นนำจากต่างประเทศ ทั้งในประเทศไทย และประเทศกัมพูชา,http://www.richsport.co.th,https://weblink.set.or.th/dat/f56/1395ONE280320241726520560T.zip
SET,COMM,SABUY,บริษัท สบาย เทคโนโลยี จำกัด (มหาชน),บริษัท สบาย เทคโนโลยี จำกัด (มหาชน) บริษัทเทคโนโลยีโดยคนไทยเริ่มแรกจากให้บริการระบบตู้เติมเงิน และได้ขยายธุรกิจหลากหลายด้านเพื่อต้องการที่จะเป็นผู้นำด้านการพัฒนาเทคโนโลยีด้านการเงิน (FinTech) ธุรกิจผลิตภัณฑ์และช่องทางการขายเข้าถึงลูกค้า (touchpoints) ที่มีระบบนิเวศน์ (ecosystem) ของตัวเองที่ครบวงจรและเข้าถึงผู้บริโภคได้มากที่สุด	ปัจจุบัน SABUY ได้ขยายตัวอย่างรวดเร็วไปสู่ธุรกิจอื่นๆ โดยมุ่งเน้นไปที่การนำเทคโนโลยีเข้ามาเพื่อตอบสนองผู้บริโภคคนไทยในยุคปัจจุบัน และก้าวข้ามขีดจำกัดที่ยังมีอยู่ ?เพื่อการเป็นผู้นำเทคโนโลยีในอนาคต?  SABUY ได้สร้าง ecosystem ของตัวเอง เพื่อตอบสนองความต้องการของผู้บริโภค ธุรกิจต่างๆ ของ SABUY ที่รวมกันเป็นระบบนิเวศน์ของตัวเอง ประกอบด้วย 6 กลุ่มธุรกิจหลัก คือ 1.Payments and Wallet 2.Enterprise & Life 3.Connext 4.Financial Inclusion 5.InnoTainment และ 6.Venture,http://www.sabuytechnology.com,https://weblink.set.or.th/dat/f56/1575ONE010420241100510297T.zip
SET,COMM,SCM,บริษัท ซัคเซสมอร์ บีอิ้งค์ จำกัด (มหาชน),ดำเนินธุรกิจจำหน่ายสินค้าอุปโภคบริโภคในรูปแบบเครือข่าย หรือ Multi-level Marketing (MLM) โดยแบ่งได้เป็น 3 ธุรกิจหลักได้แก่ (1) ธุรกิจเครื่อข่ายเพื่อจัดจำหน่ายผลิตภัณฑ์อาหารเสริมและสินค้าอุปโภคบริโภคในประเทศและต่างประเทศ (2) ธุรกิจให้บริการคำปรึกษาในการดำเนินธุรกิจเครือข่ายและรับจัดงานสัมมนา และ (3) ธุรกิจพัฒนาผลิตภัณฑ์และโรงงานผลิตสินค้า,http://www.successmore.com,https://weblink.set.or.th/dat/f56/1519ONE250320241506180906T.zip
SET,COMM,SINGER,บริษัท ซิงเกอร์ประเทศไทย จำกัด (มหาชน),บริษัท ซิงเกอร์ประเทศไทย จำกัด (มหาชน) ?บริษัท? ดำเนินธุรกิจเป็นผู้จัดจำหน่ายสินค้าอุปโภคบริโภคและสินค้าเพื่อการพาณิชย์ หลากหลายผลิตภัณฑ์ ภายใต้เครื่องหมายการค้า ?ซิงเกอร์? เช่น จักรเย็บผ้า เครื่องใช้ไฟฟ้าภายในบ้านต่างๆ อาทิ ตู้เย็น โทรทัศน์ เครื่องซักผ้า พัดลม เครื่องใช้ไฟฟ้าขนาดเล็ก เครื่องใช้ไฟฟ้าในกลุ่มบิวตี้ นอกจากนี้ยังจำหน่ายสินค้าเชิงพาณิชย์ เช่น ตู้แช่ ตู้เติมเงินโทรศัพท์มือถือออนไลน์ ตู้เติมน้ำมันแบบหยอดเหรียญ เครื่องทำน้ำหวานเกล็ดหิมะ และเป็นตัวแทนจำหน่ายโทรศัพท์เคลื่อนที่ยี่ห้อต่างๆ เพื่อสนองตอบต่อความต้องการของลูกค้าได้อย่างครอบคลุม ทั้งกลุ่มลูกค้าในครัวเรือนและกลุ่มลูกค้าเชิงพาณิชย์ ผ่านร้านค้าปลีกซึ่งเป็นสาขาของบริษัทเอง และผ่านทางตัวแทนจำหน่ายต่างๆ มีรูปแบบการขายสินค้าเป็นทั้งแบบเงินสด และการขายแบบเช่าซื้อ ซึ่งมากกว่าร้อยละ 80 ของยอดขายเป็นการขายแบบเช่าซื้อ โดยบริษัทให้เช่าซื้อผ่านทางบริษัท เอสจี แคปปิตอล จำกัด (มหาชน) หรือ SGC ซึ่งบริษัทซิงเกอร์ประเทศไทย จำกัด (มหาชน) ถือหุ้นร้อยละ 74.92,http://www.singerthai.co.th,https://weblink.set.or.th/dat/f56/0073ONE210320241404340973T.zip
SET,COMM,SPC,บริษัท สหพัฒนพิบูล จำกัด (มหาชน),เป็นตัวแทนจำหน่ายสินค้าอุปโภคบริโภค ด้วยระบบโลจิสติกส์ที่ทันสมัย ครอบคลุมทุกช่องทางการขาย และมีเครือข่ายกว้างขวางในการกระจายสินค้าหลายรายการและหลากหลายแบรนด์สู่ครอบครัวคนไทยทั่วประเทศ,http://www.sahapat.co.th,https://weblink.set.or.th/dat/f56/0035ONE290320242139190648T.zip
SET,COMM,SPI,บริษัท สหพัฒนาอินเตอร์โฮลดิ้ง จำกัด (มหาชน),แบ่งเป็น 3 ประเภท คือ 1) ธุรกิจการลงทุนในธุรกิจสินค้าอุปโภค 2) ธุรกิจการลงทุนในธุรกิจอาหารและเครื่องดื่ม และ 3) ธุรกิจการพัฒนาสวนอุตสาหกรรมและลงทุนในธุรกิจอื่นๆ,http://www.spi.co.th,https://weblink.set.or.th/dat/f56/0027ONE210320241936380918T.zip
SET,COMM,SVT,บริษัท ซันเวนดิ้ง เทคโนโลยี จำกัด (มหาชน),"จำหน่ายสินค้าผ่านเครื่องจำหน่ายสินค้าอัตโนมัติ ภายใต้เครื่องหมายการค้า ""SUNVENDING """,http://www.sunvending.co.th,https://weblink.set.or.th/dat/f56/1656ONE290320241758570309T.zip
SET,COMM,TAN,บริษัท ธนจิรา รีเทล คอร์ปอเรชั่น จำกัด (มหาชน),ค้าปลีกสินค้าไลฟ์สไตล์และแฟชั่น สินค้าบอดี้แคร์ สกินแคร์ สปา เครื่องหอม บริการสปา และ จำหน่ายอาหารและเครื่องดื่ม,http://www.tanachira.co.th,https://weblink.set.or.th/dat/f56/1847ONE290320242032040617T.zip
SET,HELTH,AHC,บริษัท โรงพยาบาลเอกชล จำกัด (มหาชน),โรงพยาบาล,http://www.aikchol.com,https://weblink.set.or.th/dat/f56/0281ONE270320241704060249T.zip
SET,HELTH,BCH,บริษัท บางกอก เชน ฮอสปิทอล จำกัด (มหาชน),บริษัทดำเนินธุรกิจในรูปแบบกลุ่มโรงพยาบาล ซึ่งมีโรงพยาบาลในเครือทั้งหมด 15 แห่ง และโพลีคลินิก 2 แห่ง ตั้งอยู่ในกรุงเทพฯ ต่างจังหวัดและในสปป.ลาว เพื่อให้บริการทางการแพทย์ในระดับปฐมภูมิ-ตติยภูมิ ภายใต้ 4 กลุ่มโรงพยาบาล คือ 1.กลุ่มโรงพยาบาลเวิลด์เมดิคอล  2.กลุ่มโรงพยาบาลเกษมราษฎร์ อินเตอร์เนชั่นแนล 3.กลุ่มโรงพยาบาลเกษมราษฎร์ และ 4.กลุ่มโรงพยาบาลการุญเวช เพื่อให้บริการครอบคลุมผู้ป่วยทุกกลุ่มตั้งแต่ผู้ป่วยทั่วไป ชาวต่างชาติ และผู้ป่วยในโครงการประกันสังคม,http://www.bangkokchainhospital.com,https://weblink.set.or.th/dat/f56/0808ONE280320241855350836T.zip
